,tweet,marker
222,wed rather current immigr polici coupl stoog like would never get,1
759,samantha dont shut fuck mind damn busi whole situat noth run fat mouth want sell pussi wou,1
870,there noth wors someon flame audac say wasnt funni someth think hyster,0
947,well call sexist im doubt hyster woman protestor btw sever hyster male protest havent see news id say sexist dear oh sorri dear sexist sorri dolli,1
290,wayn law alum rubi robinson comanag attorney michigan immigr right center organ spearhead effort stand immigr right state,0
853,alreadi hyster woman day twitter freakout leg room plane,1
357,australian senat tell un shove australia accept refuge free speech time,0
268,head mcallen texa protest cruel inhuman way govern treat immigr famili amp demand immigr refuge must releas detent agre take action,0
825,noth new alleg societi rape woman impun even p,0
591,bitch doesnt shut fuck swear god,1
347,one u solv problem vast syrian refuge crisi everi one u someth,0
375,welcom refuge,0
222,wed rather current immigr polici coupl stoog like would never get,1
245,peopl meet want refuge britain seem wonât contribut cost pay tax donât live among main young afford hord refuge cant peopl see,1
390,execut director john barcan director volunt church engag sara aardema present legaci confer host moodi bibl institut engag immigr issu gospel creativ way church tackl refuge crisi,0
980,love yoursw supremacist shut fuck whore noth ever top wing dumb bitch rb theme silk choker noth top heard bst even fuck listen masterpiec centuri,0
685,hyster woman,1
63,dont like america leav there door isolation backward enlighten u vain word get rip import terrorist pose refuge need,1
262,do noth stop steal american jobsw watch wont con billion wall fund tire useless talkit wont stop fli steal american jobsstop,1
865,shut fuck upyou idiot wonder peopl call entitl misogynist assholesyour liter pin blame femal charact huge titti one woman read post game make hundr choos one woman blame,0
402,bandaid american want total immigr reform build wall get go congress right thing,1
237,shock anyon follow refuge stori would abl predict outcometoo bad,0
60,sweden afghan migrant whose deport thwart naiv attentionseek student activist actual sentenc assault receiv prison sentenc sweden,0
165,delhi depict pathet scene aap come powerramp encroach appeas classilleg migrant jhugi sprung,1
756,bunch hyster woman protest,1
43,tri connect home cultur immigr parent like listen bunch boomer describ what wrong america lol,0
46,congrat brother ad anoth degre famili sibl how statist immigr famili,0
494,messag liber advoc open bordersif import third world get third world problem hard understand itth british nation parti continu campaign tradit britain,1
991,amaresh mishra give rape threat woman employ waah true journal,0
312,grant uk vote leav eu immigr germani crime rate go most young migrant even norway sweden problem british commonwealth lot crappi nation want citizenship expect hous etc,1
342,afghan migrant sexual abus seven child germani releas month,0
352,close centr centr migrant leav say french eu affair minist plan control center process asylum claim peopl disembark eu territori rescu sea,0
350,go open home refuge ang,0
215,crazi someon open ham sandwich chain right next door,1
102,alabama wow wonder mani legal sound terribl hear say lot peopl,1
163,unit nation call trump administr immigr polici violat human right,0
764,lol alreadi theme song stay kitchen kitchen get hot,0
604,dont give fuck weirdo shit ugli pussi yuh mother dirti friend suck dick last word,1
959,think booker hyster woman kamala,1
152,help come peopl die govt countri crimin brand send immigr pack dem send u pack wors,1
5,un pick refuge uk pick most syrian muslim,0
661,ann coulter call cori booker hyster woman,0
247,trump immigr strong,0
395,dacaag illeg far like commit crimesb jail immigr reform start clean slate,1
179,everi day everi nd day sudanes refuge need hous close countri go home crime stat disproportion theyv decad integr clear isnt safe australian keep oz safe,1
866,iron sinc muslim rape show strip club woman prostitut shes deserv,0
954,rapistsand yet five hundr year rape sexual exploit african woman girl third class,0
481,make immigr turn ventur capitalist turn compassion capitalist three act refuge act ventur capitalist act ii social impact pioneer act iii,0
354,organ fundrais bring sharehold action stop coreciv geo group hous immigr child parent colleagu lot experi area need support plea help,0
945,multiyear champion hyster woman univers award im generous call woman,1
389,may resign parti lose touch ordinari peopl uk ignor parliment vote one thing lose nh confid go ignor front line staff plea pay condit fund cut make pay immigr cost u much,1
386,know someth chucki peopl dont give rat behind say parti do enough destroy america do ideal,1
378,act_southernsyria despit extrem danger situat assad control forcedreturn shame,0
297,money pay social welfar increas togeth money refuge destroy budget peopl must decid welfar less refuge welfar without refuge isnt possibl,1
680,need ladi next train actual stfu tri deep convers work place behavior man across your loud whisper fuck earli,0
663,social medium ambassador woar woman organ rape,0
289,boat act like taxi servic econom migrant pose refuge come europ seek welfar benefit west refuge stop turkey like real refuge instea,1
212,alreadi,1
552,brown nose nikki silent donni talk pussi grab silent call black countri shit hole silent spew racist vitriol silent charlottsvill go onso stfu,1
695,kept cool human icebox occasionhyster womanroflmfao,1
701,ok sure skank as troll bot go take bath toasterno one miss go,1
510,hrc take long walk wood sink incompet void solut stack deck get fat butt kick worthless pathet skank woman,1
454,one year anniversari start ethnic clean approach,0
852,dont forget im sure lynch justifi woman never lie rape com,0
53,bulgaria say readmit migrant rest eu,0
520,hate break pussi manbut thing your respons destruct countri might abl fool liber sheep trump parti number worthless piec shit,0
778,hyster woman,1
922,wow stop write cap lock get your hystericalnow shut fuck,1
346,alreadi year wait list b fire mani migrant other wait list wait long glasgow buy self budgi get celebratori status u want send back countri origin evict scot stop,0
881,skank look good arm date mom long need start think botox mayb full facelift lie,1
584,left wh dead break abl buy million dollar home buy skank daughter million dollar apart boy would love see loan applic bank statement smell bank fraud tax shenanigan,1
968,pussi as bitch stfu,0
590,realli anyth case kindi would use low iq hyster woman zero talent,1
235,itali new coalit vow kick half million migrant free speech time,0
126,molli tibbett murder polit issu law enforc issu save american live crimin drug,1
365,meet dr bharat balasubramanian indian immigr execut director center advanc vehicl technolog univers alabama come alabama find werent enough qualifi engin mercedesbenz alabama facil,0
727,cum skank,1
787,imagin chaeyoung cut cook meat eat one u choke u die leav cold dead bodi ground bc shes bore,0
462,side coin mani migrant get hous first place tragedi tragedi get new hous,1
234,two exampl mexican govern offici blackmail u threaten flood south americanâ immigr,0
531,stfu aint make nois yet pussi,1
628,liber selfidentifi spectacular stupid egocentr liar say anyth pursuit selfelev agendaw proofjust watch compet hyster woman kavanaugh hear,1
602,hilli wont return harvskdon per guidestar foundat tax form million hand pro woman anti rape til,0
9,immigr declin cost uk economi billion say think thank independ,0
736,fuck bitch dont know fuck act your fuck whore who use get fuck random dude dont even know,1
266,pakistani goe sudden immigr jihad syndrom street toronto illeg firearm feder govern consid total handgun ban call canadian logic countri home hotel,1
488,thing think wrong shut govern get fund ask right numer time wherea gotten wrong everi time,1
324,pressur spain maritim border boatload storm spanish tourist beach amp scatter,1
853,alreadi hyster woman day twitter freakout leg room plane,1
927,u dont think rape cultur exist u u prob check feed right caus liter everi woman u know post,0
613,well hyster woman cadaver ghoulnow shut go back crypt sun,1
921,oh skank,1
620,utter scum come mock u rob u rape woman fight u think weak,0
804,rape year old woman year old state america that statutori rape rather want sex,0
669,bad thing stupid think roll back roe v wade realli need educ scotus work probabl pay like hyster woman,1
90,refuge drown crete make movi refuge industri,0
216,two polish men make perfect clear think immigr via,0
811,shut fuck snowflak think communism natzi pose hell lot threat democraci fuck call republ dictatorship googl america great servic fact censor alt right c,0
302,india wish ladi offic show spine tackl crimin netastheir atroc pooramp duti brave without fear,0
332,india tough illeg immigr bangladesh deport immigr peopl settl slowli move south,1
203,angri un job check lebanon isnt coerc syrian refuge return home lebanon stop give resid permit agenc intern staff,1
477,actual wonder safe would feel stand middl group child refuge,1
498,devast report reveal illeg migrant live one french suburb,0
798,hyster woman touch anncouldnt agre candidaci alreadi,1
45,scam magnitud take place without conniv toppl fearless expo nexusampget guilti punish,0
465,putin say muslim refuge migrant go saudi arabia iran radic belief consid norm free speech time,0
138,could proud work migrant right justic leadership watch full episod speak last night,0
829,im sick tire folk like use platform bulli differ opinion opinion differ doesnt make hyster woman call woman disrespect hes proud black man put respect,0
408,eu use turkey buffer stop refuge reach eu turkey build syria border wall kill amp injur tri cross deport ten thousand other eu want reach similar deal buffer state,0
42,immigr invad,1
92,yale law professor encourag american hide immigr ice act civil disobedi whatev happen sedit charg educ ahol like one,0
127,illeg child abus make kid make danger journey enter u illeg american kill illeg never unit kid empathi illeg game u,1
238,illeg alien alreadi sentenc sexual assault resentenc enter u illeg,1
136,alway difficult ass what truli happen countri dont know definit look good,0
332,india tough illeg immigr bangladesh deport immigr peopl settl slowli move south,1
939,suck titti finger pussi time make squirt,1
574,take second rememb rap three month ago caus see woman someth nurtur someth conquer he yell fuck hoe love,1
895,shut fuck fuck monkey jew bitch cunt nigger dick lick,1
184,american want fund wall also want speaker plea,1
767,men denigr trump accus defend oreilli deni date rape exist castig woman come forward sooner,0
496,german govern pay week vacat refuge go home includ airfar back countri claim flee unsaf armstrong econom,0
617,im do twitter express view keep say thing like might wrong that feel throught thread bc exact fear gang attack menow im solostan racist idiot bitch skank,0
241,welcom cant deport go underground,1
914,number woman accus weinstein rape rise six yesterday,0
35,ice launch new immigr sweep la area least detain far,1
466,watch austria cut benefit migrant refuge pakistani outrag free speech time,0
294,lebanon syrian refuge hope go home despit un warn al jazeera english,0
675,miss depth hyster candi corngat episod tonight,0
3,invas issu mexican,1
505,last bitch talk look anyway stick dusti as tongu back ya musti std fill mouth shut fuck hoe,1
972,slutwhorebitch cunt coulter,0
245,peopl meet want refuge britain seem wonât contribut cost pay tax donât live among main young afford hord refuge cant peopl see,1
939,suck titti finger pussi time make squirt,1
114,tell barack sir thank mr trump fix polici hey obama mayb go sell gun cartel sell pay phoni,1
738,like care charm tim think lose residu masculin borrow brilliant express im skank piec shit know men cant becom woman get toxic quick tran brigad that male power,0
1,im immigr trump right immigr give insight stori,0
208,couldnt negoti chocol bar sweeti shop cameron deal immigr never mind failur,0
147,open thread night owl un complet new world migrat compact u holdout,0
664,compet ugly nasty skank america,1
256,hundr arrest dc protest immigr polici,0
902,shut fuck know your bitch whore,1
915,fight russia pussi potus,0
568,corey booker kamala harriss compet hyster woman senat,1
152,help come peopl die govt countri crimin brand send immigr pack dem send u pack wors,1
132,iraqi immigr accus shoot colorado cop crimin histori yet avoid deport report say,0
721,nicki album bomb af swear yall nigga realli dont like woman sound like hatin bitch go put skirt stfu,1
371,mexican central america immigr want u nativ speaker speak spanish joke,0
135,theyv spread everi corner countri appar million know mani realli million infiltr u must go,1
626,realli hard tell hyster woman senat hear week,1
180,last time sing sing immigr song today yesterday,0
490,two third british public think immigr highalmost three quarter think uk crowd think immigr negat effect avail hous,1
743,unfortun remind men kind shut fuck tell woman femin call make woman decid mayb well disagre woman woman decid what femin one ask approv,0
796,miss pussi,0
977,rememb woman inferior men even though general test well everyth men doit fault suck there noth push away thing,1
189,use foreign aid budget help illeg migrant go back home via,1
884,lot peopl tell woman dont speak rape cultur via,0
815,sex cool u ever come back school find parent arent home u scream fuck bitch im fuck home alon cunt yuhhhhhhhh cuz,0
448,folk perceiv work,1
406,correct come town near,1
324,pressur spain maritim border boatload storm spanish tourist beach amp scatter,1
814,yall get ta learn start see woman human yall act like alien yes cunt tit sweeti sexual sexual enough well either way non fuck busi go choke inch cock,0
632,hyster chine insult know today nsfw,0
652,ive see break tear audienc turn let talk hyster woman,0
809,dont like song bitch keep move hoe cant sing cant shit suck dick bitch stfu dumb white trash as bitch,1
42,immigr invad,1
98,yearold touch live,0
145,like video immigr protest unknow agre trump,0
321,appar consid set annual refuge admiss cap low number admit would blow smithereen budget nine feder resettl contractorslearn nine suppos chariti,1
71,infuri never see german french italian govt award contract uk busi favour,0
183,eu keen strike deal muammar gaddafi immigr world news guardian,0
339,countri scar violenc lgbti activ alway welcom sofia daniel stori,0
374,understand mind immigr undocu illeg break law therefor stay countri law respect,1
633,wah make million year wah fuckin bitch bro cri river pussi,0
271,grandma immigr mexico that right im white im pro immigr dont encourag anyon move mental ill prerequisit dont govern give forc,0
384,andrew cuomo self proclaim undocu immigr free crimin say jihad deport illeg that akin flip bird taxpay your embarrass amp disappoint law abi,1
522,u woman leav alon get anough skank problem,1
407,must pass law deport border court illeg includ central american cross border illeg asylum contest remov order mandatori everifi,1
484,nolotteri get line,1
437,romanian andrei parvu american ethan todd grown individu faith god friendship face hardship red tape encount tri obtain govt approv parvu fbc madisonvill pastor,0
958,fact he best sandwich maker side mississippi,0
783,mention book clair didnt stay kitchen either woman clear doesnt know shes talk howev yes much woman cook clean etc,1
344,syrian refuge right move uk shame welcom refuge either middl class idiot ex refuge,1
950,quit thing man hide cupboard evad charg rape accus woman creepi,0
359,stand ground publish truth ignor backlash mail pull stori migrantinfest pari suburb backlash,0
48,unless your third world rapefuge,0
681,stfu there million peopl without dad your rich bitch get,1
282,kaepernickput foot mouth disrespect fan exampl sacrif everythingthey exampl ignor,1
670,hyster woman kavanaugh hear today,0
551,besid disgust rape joke fuck old like tell woman go back kitchen smh,0
581,yall degrad ikon watch might popular one versatil kpop group cant bring era continu shine longer anyth stop stfu,0
483,clinton illeg immigr via,0
713,woman write status might give peopl sen magnitud problem,0
449,medium silent govt use vega shoot push bill allow warrantless search,0
152,help come peopl die govt countri crimin brand send immigr pack dem send u pack wors,1
83,,1
726,your whole entir bitch mother father probabl brother sister stupid fuck cunt,1
656,pretti hyster,1
895,shut fuck fuck monkey jew bitch cunt nigger dick lick,1
636,guy get hyster tri pin berni loss anyon particul,0
433,make liber cri one tweet,1
326,illeg alien take life decid would break u steal id ssn work illeg rob u instead send famili kill realli didnt care famili huh,1
746,get job fat daddi fuck cunt that im pay rent dumb as hoe,1
762,stupid fuck cunt dont like your gon na speed stop bus tri run year old wan na act like tough as come face dont put kid safeti risk caus your stupid bitch,1
685,hyster woman,1
227,bloodi disgrac keep polit school,1
931,hyster woman nice gender separ person ann get hard grasp one plea tri,1
473,give un access return rohingya refuge,0
486,american worker winningtrump cut suppli wagelow migrant labor execut complain bitter forc compet worker offer high wage restaur rais wage fill job restaur,0
134,save live,1
518,skank grahamjohn mccain would asham,1
567,peopl hyster dow sinc elect,0
752,copper sandwich maker sweep sponsor money nut kitchen author enter today,0
598,rape woman talk woman role,0
653,meadowland mama piti parti gon na stop use taxi coz skank call fat,1
407,must pass law deport border court illeg includ central american cross border illeg asylum contest remov order mandatori everifi,1
728,scream decad last time roe v wade actual threatenedask honest plea shut fuck,0
908,thank ruin footbal pussi cant watch anymor bore,0
609,hi bitch pls u skank as hoe aint bouta shit throw hand tomorrow sinc bold twitter,1
936,uplift discours realli scumbagyour republican presid talk grab woman pussi support neonazi separ kid famili your talk uplift discours stfu,0
591,bitch doesnt shut fuck swear god,1
289,boat act like taxi servic econom migrant pose refuge come europ seek welfar benefit west refuge stop turkey like real refuge instea,1
494,messag liber advoc open bordersif import third world get third world problem hard understand itth british nation parti continu campaign tradit britain,1
154,costa del crisi migrant pour europ new spanish gateway one,0
288,power help rebuild live hand get start tonight âž_xd_,0
997,honey fellow white chick let tell need shut fuck quit tell black woman feel talk black woman stay damn lane bitch im talk whatev,0
667,ahh see final embrac inner blond skank good mitch,1
737,get pussi,1
964,take heat that l stay kitchenyou cant deni woman fear speak truth power without hesit may older cup tea fight love countri polit,0
190,sweden k loxbo voter percept polici converg shortterm opportun antiimmigr parti exampl sweden scandinavian polit studi pp,0
124,guess say pay illeg alien dave,1
523,lol admit love jailhous rest case your pathet hyster beyond funn,0
588,bitch u whole catfish trynna get fuck u janitor closet mind your,0
803,check tweet hyster womanscumbag swamp creaturezippi,1
837,jos wan na say fuck u cube,0
856,hyster woman,0
307,enough monster continu import monster countri,1
471,ive enter mobo unsung remix tombak wish luck,0
965,say hyster woman,0
817,sell venu california bus skank like matter time bless theindiggn band vibrat,0
372,suspect migrant find dead evro,0
8,violenc toward tourist barcelona spain tourist go home refuge welcom,0
823,whatev make happi realli bitch good friend mother fuck cunt,1
172,question make someon understand say get countri isnt someth former illeg immigr take light probabl ever forgiv ask friend ive tri everi nice way mayb time say hate peopl say racist shit,0
878,nigga get cri bout get play everyday lol woman like weird niggasfunni nigga athlet niggasthug nigga etc find bitch yo arena stfu,0
599,mom hair pussi need stfu lmfao,1
409,nontradit school design help immigr refuge student acclim,0
225,white south african farmer appli refuge protect australia special treatment via stop white genocideaccept white immigr,0
519,like woman rape woman aswel woman rape men aswel men rape men aswel,0
922,wow stop write cap lock get your hystericalnow shut fuck,1
474,mad get inspir former presid germani gauck happi lover refuge love multikulti warn refuge destroy germani societi afraid,0
512,sad woman wear noth intent action rape sorri go,0
824,guy rape woman clear problem woman speak one help,0
794,nah yall stay kitchen make barii baasto,1
708,bitch aint one hate join club stand corner stfu,1
491,modriä_xd_ grandfath relat kill balkan war mandzukiä_xd_ spend childhood germani refuge croatia stori incred recent memori,0
453,janic holbrook line john woodland immigr possibl bear bedfordshir england,0
114,tell barack sir thank mr trump fix polici hey obama mayb go sell gun cartel sell pay phoni,1
291,still look nazi mirror rememb pack lunch one want eat lunch person whose food spit immigr worker restaur kitchen,1
446,hear hear may bow grovel plea pleas princ what name give gong number send nurs home near buckfast palac as wipe immigr call alic rememb mr austeri,1
643,cant wait daughter fulli understand bad rape woman actual peopl,0
20,un call stop separ immigr child parent,0
715,whoever send rude as messag fuck cunt cant get grief especi mother mean fuck sake spend nine month insid woman mourn last lifetim especi,0
158,politician new world order globalist intent dilut popul divid countri migrant anywher import get rid globalist govern oz agai,0
984,regina georg nasty skank bitch ever meet trust fug slut,1
744,bitch money talk stfu hoe go make bread,1
678,stfu hoe bad bitch,1
490,two third british public think immigr highalmost three quarter think uk crowd think immigr negat effect avail hous,1
973,wan na know sexism look like go skank miss odwyer,0
970,tri destroy miss kid first day school skank topless yet anoth man disgrac kid good dad theyr happi safe stabl love home,1
886,poster local rape crisi old woman walker raggi cloth titl say must someth wore,0
141,keep love brother sister dont forget show hospit stranger do entertain angel without realiz hebrew,0
828,fuck pussi,0
677,mr fuck graham shut fuck fuck abort goddamn son bitch fucker take away right woman right bodi son bitch,0
309,coward last activ parti member involv illeg immigr industri,1
793,alreadi control border hyster loon,0
656,pretti hyster,1
944,stfu pussi appl music,1
129,tabl museum jewish heritag live memori holocaust immigr art amp woman empower summit,0
757,hyster woman aliv go find island stay,1
869,aight goodnight whore except girl that tl bash guy hoe stfu bos bitch,1
638,hyster make sooner grow pair ban shit paper well,0
625,shes kind skank dont want see light come close time along melania ivanka russian skank,1
69,meanwhil syria russia iran pretend safe refuge return,0
539,fri pussi,0
572,fight round minut cage match looser leav town match come pussi,0
546,hold im jack perfect way end argument ima like yo stfu wan na argu get yall pussi ate pick one,0
876,bitch shut fuck,1
52,press report note lat leave shout immigr immigr welcom trial question uk citizen accus abus girl leave demonstr immigr,0
644,booker kamala compet hyster woman kavanaugh hearingsspartacus,1
562,listen skank sugar daddi big x draftdodg punkbitch coward countri opinion mean noth go find stripper pole whatev stfu cowardic enough melania trump,1
842,huge number say thank skank repres wasnt involv saw illiter hooker pimp tri influenc other one walk away republican barbi anal wart wont,1
741,pussi boy,0
343,sweden bar refuge return syria give benefit instead,0
104,crime rise rural area threat ice keep immigr communiti report polic polic nationwid visit,0
979,well seem trump tweet cool wow woman insult go well togeth get call skank get tell stds mean misogyni goe base guess lol also someon call hick ultim ironi wow,0
877,booker hyster woman harri common slut,0
553,skank look like half man half actual nerv make fun someon el look cant make kind stupid ugli look like surgeri success congrat dude btw f,1
747,hilli put anyth support woman anti rape wont return harv donat alway money clinton,0
876,bitch shut fuck,1
405,refuge tanzania worri forcibl repatri via,0
232,ireland indian subcontin taxi driver fake marriag immigr scam expo,0
810,screw face skank music,0
553,skank look like half man half actual nerv make fun someon el look cant make kind stupid ugli look like surgeri success congrat dude btw f,1
12,realiti nike unlik groupi never buy product enough enough ugli crap enough alreadi love flag,1
575,nike becom even well hit daughter hand bitch stfu nike grab pussi,0
424,illeg alien charg kill two miami woman dump bodi street,1
624,addit play hyster woman trope assum design use tear later film nonetheless annoy time tri watch,0
868,realli mr grab em pussi yes talk like werent elect instil russia stfu moron your go prison traitor tot,0
142,past day eu give cover eu state crack chariti save refuge amp migrant sea drown tri flee horror libya,0
330,terribl wrong practic fall direct hand yearold girl sexual abus immigrantdetent center via,0
694,yea fuck as hole mother fuck bitch grrrrr,1
