,tweet,marker
406,correct come town near,1
388,oop amp amp sorri think adult twitter need mommydaddi,0
374,understand mind immigr undocu illeg break law therefor stay countri law respect,1
125,refuge syria one nation sinc wow,0
960,bitch first that talk mean second da hoe hoe stfu,1
222,wed rather current immigr polici coupl stoog like would never get,1
755,believ hyster woman kamela harri,0
168,life eu core lunat want bring aggress male migrant embrac pervert valu brussel czech must open repudi punk zit cultur sale door open alreadi late,1
265,read reread love convers jjla speaker novel everyon know go home,0
367,trump let build wall deport illeg walk across border like central parkm,1
282,kaepernickput foot mouth disrespect fan exampl sacrif everythingthey exampl ignor,1
723,everyon call u btch u dont like bitch like whaaat wouldnt call bitch u wore like whore wait someon dig dick stfu barbi yo nigga disagre,1
470,ryan set hous vote gop immigr bill,0
348,poll le percent american want give amnesti illeg alien,1
57,daca ppl want chain migrat amp take court liber judg give want amp trump plan introduc welfar amp citizenship welfar suspect think twice b come u,0
153,philli archbishop europ futur face young muslim immigr,0
656,pretti hyster,1
637,american get shoot even care woman around world suffer hand islam savag beat acid attack rape murder gun scari arent,0
746,get job fat daddi fuck cunt that im pay rent dumb as hoe,1
718,stfu two foot pussi bitch,1
657,hyster woman,1
284,melissa commit friendship partner refuge famili resettl know experi would chang know go pretti big volunt thing take serious,0
422,u open border allow million immigr everi year want come u legal citizen must obey u law illeg,1
266,pakistani goe sudden immigr jihad syndrom street toronto illeg firearm feder govern consid total handgun ban call canadian logic countri home hotel,1
849,christian critic muslim men savag rape woman show ankl christian men rape wom,0
72,dont smell conspiraci theori turkey smash entri point refuge go nice tri turkey,1
148,june let call stand send power messag lawmak welcom refuge,0
723,everyon call u btch u dont like bitch like whaaat wouldnt call bitch u wore like whore wait someon dig dick stfu barbi yo nigga disagre,1
121,illeg crosser crimin record u unknown percentag commit crime home countri migrant crimin record ten parent,1
935,realli ann hyster woman wrong,0
55,make blood boil pay tax pay social secur green card like countless immigr pay fica social secur medicar intern student status go home never see penni money back,0
450,rise conflict displac across africa unlik fall without great attent pay end old war prevent new one respond refuge popul point past failur demand new improv respons,0
630,oh pussi grab lie jack as,0
605,aka stupid man ugli toe couldnt even groceri shop bitch charg neck as hoe ill yank ur slide go full chancla u bitch fuck bitch fuck u fuck retail oh god bruh plea may punch,0
419,bih ten situat local alarm choic complic either europ implement ongo deport mechan hold hostag action othersðÿthi insur unlimit migrant amp endless game reloc,1
689,stop name call grow pair ball dont say anyth stupid know truth come havent releas statement evid instead arrog pest rememb believ woman cant rape men also mean think cant rape woman either,1
976,stupid skank bare speak english,1
312,grant uk vote leav eu immigr germani crime rate go most young migrant even norway sweden problem british commonwealth lot crappi nation want citizenship expect hous etc,1
912,fuck u raw tongu kiss drop hoe meet famili eat yo pussi backand tell love dont mean u itch,1
912,fuck u raw tongu kiss drop hoe meet famili eat yo pussi backand tell love dont mean u itch,1
603,yeah stfu pussi aint copi shit im talk shit yet sit act like shit mad cant make music first place,0
559,fake feminist hypocrit one word woman beater one word hollywood rape woman teenag hypocrit like obama hypocrit,0
293,immigr law one talk,0
909,ever hit w dumb fuck cunt as fuck stupid as fuck bitch know im extrem mad,1
326,illeg alien take life decid would break u steal id ssn work illeg rob u instead send famili kill realli didnt care famili huh,1
475,guatemala send finest,1
615,wait also fuck gift get man marriag also go virgin sinc know god make virgin stfu hope never get laid,0
859,ceta take year could take even longer happen meantim creatur stfu remain singl market whilst do stfu fall apart remain sm,0
947,well call sexist im doubt hyster woman protestor btw sever hyster male protest havent see news id say sexist dear oh sorri dear sexist sorri dolli,1
447,further thing sir,0
461,damn structur eu polici tacit support perhap even fee tortur enslav migrant libya profit,0
303,happen burundian refuge tanzania shame amp outrag refuge nyarugusu camp tell effect theyr allow go outsid campal small busi closemarket open onceweek instead time,0
682,your bitch stop frig skank give back,1
873,recent exampl woman one condescend icooca teen charact call skank tell see ooc reaction talk small stuff like increas play confid charact especi young one,0
562,listen skank sugar daddi big x draftdodg punkbitch coward countri opinion mean noth go find stripper pole whatev stfu cowardic enough melania trump,1
592,dude shut fuck sound like like fuck pussi,0
356,larg scale migrat illeg migrant delhihawk menaceilleg constructionsappeas increas aap come power,0
143,professor sked eu split mani issu eg futur eurozon migrat despit right say like betray parti parliament,0
607,scare theyll take crown reign hyster woman long like safe,1
179,everi day everi nd day sudanes refuge need hous close countri go home crime stat disproportion theyv decad integr clear isnt safe australian keep oz safe,1
28,lose happi merkel co realiz realiti realli poor germani want go love refuge,1
647,littl skank stamp ankl asid today im walk funni get right bone stud littl cunt,1
982,pussi,0
492,ruth davidson interest lover immigr right anyth use poor scotland except suggest photo,1
934,woman way list rape causat factor still list ure potenti,0
393,hondsbrutal asielkolonist oostenrijk moeten leren integreren door migranten hui te nemen en ze geld te geven via,0
990,lord merci hyster woman research claim need take nap,1
944,stfu pussi appl music,1
703,shouldnt worri pretti littl head thing like perjuryask wife woman accept today corrupt gop plan return u hyster woman stay barefoot pregnantyouv show u believ,0
835,lmfao boi stfu definit get pussi mental know,0
134,save live,1
315,watch italian chef shovel beat migrant throw stone restaur free speech time,1
556,man rape fantasi write pay woman staff less call pp establish woman rig,0
879,isnt guy encourag men rape woman,0
805,alreadi hold titl hyster racist whine beetch stfu,1
368,refuge dont get food water go back quick presid havnt much,1
35,ice launch new immigr sweep la area least detain far,1
392,hous cost high allow world invad that issueto ignor role immigr invas white genocid hous disast isnt irrespons crimin,1
84,kind goon buffoon stop magazin launch,0
489,ingraham sorri pollster amp say wacki leave amp lebron go jump creek meet,0
490,two third british public think immigr highalmost three quarter think uk crowd think immigr negat effect avail hous,1
322,protest italian interior ministri rome migrant death sea,0
122,black refuge take italian ship like pirat allow go board itali,1
75,mexican natur american follow immigr law pay fee wait sacrific lot pinch parasito come demand crap demand ice fk job deport parasit like pendejo asap,1
707,peopl stop sexual assault rape men woman think right want other,0
545,say bitch wont stop say stfu hoe,1
111,corbyn still maintain blair new labour essenti marxism danger cult put migrant first usual member polit religi cult would kill member left migrant return vote labour thus far evil,1
91,salvini reiter hard line migrant libya visit,0
493,illeg rohingya migrant send back say rijiju need go back home countri india legal,0
795,follow might know god know whoever charg kind lie monster dont think skank paula white side wont go flame,1
760,hyou bitch stfu ilym stupid dumb hoe,1
440,ice job stop obfusc immigr issu conflat term immigr illeg alien theyr illeg break u law need go back,1
335,eu stop massmigr africa bring everyon europ eu idiot destroy europ,1
337,rescu migrant escap north africa expect arriv sunday spain,0
334,soft immigr trump forgot prais presid obama deport number republican couldv comprehens immigr reform year ago knowobstruct plan matter,0
214,famili hous ad burmes food chicago culinari scene own refuge famili check yet,0
808,aint bitch tri rape,0
616,im eat pussi pleasur dont care nut time smack head run away smash head yo leg cri im finish bitch im finish stfu stop cri,1
501,yo pussi equival list celebr fuck u mean,1
924,shes scank hole bitch lie lowlif,1
374,understand mind immigr undocu illeg break law therefor stay countri law respect,1
317,benefit immigr come amp make go back home,1
584,left wh dead break abl buy million dollar home buy skank daughter million dollar apart boy would love see loan applic bank statement smell bank fraud tax shenanigan,1
535,idc shes one confirm two year sinc theyv date obvious think long hard abt come coupl shut fuck,0
554,two blueblood redneck yeah appar possibl shout iranian bos trmp hasnt commit treason hillari russian stole dem primari berniei tell sound like hyster womenthey leave,0
2,im go shock peopl america america even defin america repres republ true,1
820,grant first point joke insultabout second point though call hyster person hyster doesnt set anyon back hyster woman men bitch douchebag asshol kind gender,0
533,that youv alreadi titl raggidi skank whos disappoint father,1
761,repres woman theyr repres hyster woman want whine cri presid boom economi major u woman agre check articl,1
246,hellow african immigr arent vandheri,0
4,worker charg sexual molest eight child immigr shelter,0
541,hollywood tale u judg guy pig harvey weinsteinmor woman accus hollywood produc rape,0
765,macchiato would love cook home ec class could stay kitchen sampl make,1
855,best lessoni learn stfu listen peopl good trigger solid advic think person attack mayb mayb person know takin obvious someth right,0
487,play ordinari poor peopl live like monopoli board throw dice peopl never get jail migrant win,1
236,ðÿðÿðÿµðÿ¼barcelona citi council last month decid back migrant come area tourist say tourism wreck popular neighborhood rais valu etc whilst migrant bring new life countri,0
909,ever hit w dumb fuck cunt as fuck stupid as fuck bitch know im extrem mad,1
616,im eat pussi pleasur dont care nut time smack head run away smash head yo leg cri im finish bitch im finish stfu stop cri,1
772,salli field love life burt go grave regret lose get old number dont count except skank like kirk dougla,0
867,woman most rape sexual assault victim keep quiet co one believ u still,0
919,hate love demon worship mental ill hyster woman rebel dont give fig anymor social norm want studi stem busi screw assumpt busi cupcak bakeriesi still kind love woman,0
432,meanwhil israel african refuge deport forceafrican refuge woman forc take contracept white jew welcom israel get isra citizenship black,1
940,shut fuck pussi grab perverthow divorceit mueller time,0
25,tourist go home refuge welcom barcelona choose migrant visitor,0
355,migrant unhcr say migrant arriv emerg spain,0
128,weasel tri share risk wothersðÿreluct allow other involv regard appropri secur clearanc vet migrant share itali complain neglig greeceitali year ago,0
21,lesson past eastern european nation reject muslim migrant lessonspasteasterneuropeannationsrejectmuslimmigr sweden rape increas sinc embrac multiculturalismi report verg collaps,0
220,global refuge number reach record high u take record number,0
910,skank man get,0
832,fuck face scari hoe dont say noth peopl look pussi post bitch fuck compet sit fuck shut fuck bitch wan na talk look where pic stay lane,1
299,other must uncondit reject reloc make plan sealoff spain surround area must allow reckless decis other hold hostageto stop mad migrant must stay n spainðÿsoon later follow lead,0
985,bitch want halloween care pack skank doesnt appreci,1
435,ice contact polic pull van driver flee foot peopl without document find insid via,0
786,see ur close girlfriend public hey u stupid fuck slut bitch hate u see girl u dont realli like hey girl omgggg u beeeennn foreverrrrrr,1
297,money pay social welfar increas togeth money refuge destroy budget peopl must decid welfar less refuge welfar without refuge isnt possibl,1
115,illeg alien deport time arrest hitrun crash hurt yearold,1
607,scare theyll take crown reign hyster woman long like safe,1
301,love episod great job ladi,0
778,hyster woman,1
806,yep stone woman death report rape report scandal,0
623,wow idea call booker harri hyster woman racist amaz thing get redefin daili basi,1
68,admir strength amp resili million refuge help u ensur refuge enter u year feel welcom amp support gtgt,0
655,anyon recogn hyster woman look mirror,1
317,benefit immigr come amp make go back home,1
571,smoke much stfu pussi,1
618,encourag men sex deni woman right bodi also promot rape cultur sinc woman say option,0
692,hyster moron even know th amend shut fuck cut,0
78,refuge want return concern secur want monitor return,0
909,ever hit w dumb fuck cunt as fuck stupid as fuck bitch know im extrem mad,1
928,pussi bitchhhhhhhh eat lil hoe know bang wit u rollllllinnnnn mine ion da groovin yadig,1
671,ok like stfu hoe,1
730,fuck call cracker bitch your go attack nice fuck cunt,1
224,illeg immigr make bold statement finish pay medic bill use money work,0
440,ice job stop obfusc immigr issu conflat term immigr illeg alien theyr illeg break u law need go back,1
385,confid scotland wouldnt grant vote amp want import en mass keep power live corrupt despot,1
459,powder keg mile eiffel tower illeg migrant live parallel islam state franc via,0
917,send btc anyon explain usa need import iq somali rape white woman high rate,0
985,bitch want halloween care pack skank doesnt appreci,1
100,mother w famili,1
831,dont like nigerian men get go marri american british men small thing nigerian men nigerian men thatyour feminist your manhatingcretin stem blowback greed bad tast men stfu,1
507,shut fuck pussi boy,0
994,your skank everyon know otherwis wouldnt make excus settl whilst hang multipl differ guy,1
843,hi way get ladi stop shout hear opposit desir effect love silent handmaid scream hyster woman insult caus mayb hold sign instead,1
353,proud mani refuge take leav peopl b hind grow disdain emerg,1
311,thank heart minist father libyan author coastguard save bring back libya immigr matteo salvini italian prime minist,0
32,anoth immigr sexual assault case ignor msm,0
307,enough monster continu import monster countri,1
601,fuck u slut pork dead father burn hell fuck face jewelleri seller bitch,1
22,grant extra fund cope migrant arriv,0
681,stfu there million peopl without dad your rich bitch get,1
245,peopl meet want refuge britain seem wonât contribut cost pay tax donât live among main young afford hord refuge cant peopl see,1
563,cri ard pussi as bitch stfu aint cute,1
19,doesnt partisan issu among voter alreadi isnt accord poll congress take notic peopl polit ideolog acknowledg u need,0
506,plea tell u arent go whine next month like youv jeff session could fire session moment reclus noooo continu pussi,0
905,guy spent five year hide rape inquiri think power woman creepi man,0
242,need true valu church reach vulner refuge vulner,0
102,alabama wow wonder mani legal sound terribl hear say lot peopl,1
882,unintellig hyster woman woman mental case,1
851,your go bother actual anyth shut dont bother sign hyster woman,0
922,wow stop write cap lock get your hystericalnow shut fuck,1
946,hoe stop fuck lie caus phone month dead till bitch u think u disrespect kidit mewher da fuck u like bitch u act crazydi aint act bitch talk shit im gon na,1
887,usual dont hate peopl actual hate bitch tri friend outsid work crisi decid profession use that bad type person fuck cunt get though,1
122,black refuge take italian ship like pirat allow go board itali,1
275,thousand vulner migrant child across europ unaccompani separ child arriv alon accord yet amend never proper implement,0
627,your skank cant afford wireless headphon stick rotten android phone buhby,1
765,macchiato would love cook home ec class could stay kitchen sampl make,1
799,receiv dick pic lol u ugli bitch fuck u slut messag,0
127,illeg child abus make kid make danger journey enter u illeg american kill illeg never unit kid empathi illeg game u,1
589,hilari shriek hyster woman annoy regardless point tri get across adult,1
469,law allow separ migrant child tell flee countri lawsuit say via,0
699,susan lose credibl need stfu say,1
37,cameron stop immigr vote eu vote learn scot independ immigr negat infeuenc,1
534,booti fever bitch,0
830,thing woman speak rape nigerian twitterth backlash would shock good mind henc silenc,0
906,lol your probabl tweet hard move dick pussi shut fuck fake hoe,1
39,search continu five suspect refuge flee lorri,0
871,immigr rape old english woman tell heryour bitch countri im saddam hussein,0
949,bitch calm pussi yo ppl aint around,1
155,inspir african athlet championship august allow space refuge shine,0
264,africa african asia asian white countri everyon white genocideto ignor role immigr invas white genocid hous disast isnt irrespons criminalh,1
97,taxpay burden expens legal process illeg refugeesyour opinion,1
609,hi bitch pls u skank as hoe aint bouta shit throw hand tomorrow sinc bold twitter,1
336,pas immigr kill,1
933,everi woman ever know experienc sexual harass assault rape say bad,0
263,refuge welcom turist go home,0
351,busi refuge camp amaz resili difficult circumst,0
418,humanitarian ship resum mediterranean migrant rescu patrol despit european resist abc news via,0
969,dad chef hous whole woman need stay kitchen doesnt make sen,0
577,cori booker think he hyster woman senat,0
289,boat act like taxi servic econom migrant pose refuge come europ seek welfar benefit west refuge stop turkey like real refuge instea,1
134,save live,1
140,dehumanis illeg isnt torus flash pan span govern uk wont die till come broad understand migrat simpli crime one,0
504,yea actual get pas horribl crap skank black white peopl dont pas,0
646,bitch give fuck u fill ur glasssimon get instead that right whore im talk oh thank bill good realli fuck wasnt,1
497,import messag fan next month join good friend convers immigr health chat take place septemb pm et use hashtag see,0
805,alreadi hold titl hyster racist whine beetch stfu,1
805,alreadi hold titl hyster racist whine beetch stfu,1
616,im eat pussi pleasur dont care nut time smack head run away smash head yo leg cri im finish bitch im finish stfu stop cri,1
574,take second rememb rap three month ago caus see woman someth nurtur someth conquer he yell fuck hoe love,1
259,midlothian set ban firework yes what real reason ban mayb syrian refuge might give bad memori,0
558,enough thousand thousand angria get elect lose your like hilari clintonspoil petul entitledstfu,1
376,russia build forc syria action isi welcom start talk migrant,1
694,yea fuck as hole mother fuck bitch grrrrr,1
895,shut fuck fuck monkey jew bitch cunt nigger dick lick,1
875,alessia fkn skank go chang,1
650,dont understand work hard sex work nut sex even situat work huh your anoth bitch work store furthermor cant anyth need die bitch die,1
888,goto analog mean girl cliqu polici ohmigod guy berni isnt even democrat kay cant sit u pass book berni nasty skank bitch ever meet trust fug,0
840,ben sas correct sinc ive ever hear everi two year elect hyster woman leftist act backalley abort shit get old didnt hear one protest issu yell hear that piti,1
444,white assimil non white immigr homeland build u ancestor dont assimil that perfect finethi invas ðÿðÿ,1
107,report illeg immigr child strang know littl amp kiddi scam expo,0
249,politifact florida bill nelson claim detain immigr parent charg minut call child true,0
233,anoth reason easi jihadist islam countri slide across border illeg folk mexico central americaparanoid mayb littl dont want see countri look like european countri,1
203,angri un job check lebanon isnt coerc syrian refuge return home lebanon stop give resid permit agenc intern staff,1
748,hate meme go dear girl stop ___ think boy like dont like fuck cunt think even spend second day think dumbass prefer yall dumb lmaoooooo woman dont give fuck,0
985,bitch want halloween care pack skank doesnt appreci,1
386,know someth chucki peopl dont give rat behind say parti do enough destroy america do ideal,1
960,bitch first that talk mean second da hoe hoe stfu,1
880,u rabid fuck cunt oh yea u indiana tho common u woman folk ask mother penc,1
929,men need respect woman point blank excus rape shouldnt justifi excus,0
7,global compact migrat move forward,0
18,must reject global indiffer toward refuge say presid intern cathol migrat commiss,0
325,u immigr mother say child suffer trauma,0
843,hi way get ladi stop shout hear opposit desir effect love silent handmaid scream hyster woman insult caus mayb hold sign instead,1
164,know kid parent prison kid foster care separ militari parent know theyll see medium focus kid temporarili separ illeg immigr sink,0
739,god didnt make woman fuck cunt love sure hell gon na fuck whenev want wherev want stop embarrass shit,0
369,syrian refuge set weekend school nl teach child arab,0
161,job workersguest worker prg need support,1
127,illeg child abus make kid make danger journey enter u illeg american kill illeg never unit kid empathi illeg game u,1
700,ad video playlist skank tanto want ao vivo,0
673,urgh tmj pain full pelt morn pain littl sleep im separ parent inform programm court dont seem buy cant communic ex he abus im hyster woman need teach,0
332,india tough illeg immigr bangladesh deport immigr peopl settl slowli move south,1
671,ok like stfu hoe,1
660,fuck talk pussi state point til bitch as team beat outlaw battl texa dont give fuck anyth el eat dick shut fuck,1
597,idk im lot nicer peopl dont like much peopl truli love get call skank bitch someth natur,0
862,mean meaningless cult mindless drone peopl ignor fact like trump dont brain fact go core valu kiss as,0
67,want propper diet meal join foodbank want council hous come back batter syria iran away behind time nan english leason immigr want learn english get countri dont speak english,0
191,illeg alien expens,0
383,obama right say mani time,0
558,enough thousand thousand angria get elect lose your like hilari clintonspoil petul entitledstfu,1
949,bitch calm pussi yo ppl aint around,1
656,pretti hyster,1
73,exclus sanction libya coastguard command say hit migrant,1
557,truli hyster togeth tend agre w tho never know need snack,0
532,god dammit boy van talk hyster congrat everyth,0
678,stfu hoe bad bitch,1
386,know someth chucki peopl dont give rat behind say parti do enough destroy america do ideal,1
323,room go home immigr main part new hampshir full,1
226,utah nonprofit help hundr refuge go colleg place kai sin call home refuge camp bear famili escap ethnic violenc myanmar,0
579,idol liter arent gon na trust yall date shit anymor like fuck actual want honest yall trust yall enough talk yall ruin fuck career im piss knetz choke gn,0
621,im perfect happi boyfriend bitch dont worri karma come skank as,1
500,shit ima choke yo as back say mine even tho im yo side nigga,1
333,vanguard eighth annual event immigr law defend immigr right keep famili togeth davi vanguard,0
590,realli anyth case kindi would use low iq hyster woman zero talent,1
169,offer pay countri â euro per person take migrant,0
111,corbyn still maintain blair new labour essenti marxism danger cult put migrant first usual member polit religi cult would kill member left migrant return vote labour thus far evil,1
639,woman scorn woman charg rape make hard woman seek help half pop gether rise,0
610,wait peopl actual swine flu catch bin kill skank real,0
310,non white immigr love freedom speech bash white menbut freedom speech creat white men ðÿƒðÿƒðÿƒ,1
667,ahh see final embrac inner blond skank good mitch,1
407,must pass law deport border court illeg includ central american cross border illeg asylum contest remov order mandatori everifi,1
73,exclus sanction libya coastguard command say hit migrant,1
720,girl work today bad come across hyster woman,1
600,costum parti pic slut bitch nude lesbian photo,1
159,problem toronto diver look ricardo duchesn canada decay white genocid crime polici optionto ignor role immigr invas hous disast isnt irrespons criminalhtt,1
586,bitch stole tip steal right back fuck cunti hate serv,1
694,yea fuck as hole mother fuck bitch grrrrr,1
635,shut fuck treason bitch whore hurri die alreadi,1
702,also clench jaw grind fuck poor teeth say pleasant thing like die fuck bitch fuck cunt monster smash rage spidey,0
174,antonio sabato jr im immigr amp support trump wall via,0
916,need pussi,1
150,donni separ immigr famili reunit famili respons,0
306,usa may welcom immigr refuge current govern sure welcom hacker,0
904,rape joke matter time speak light woman,0
430,googl welcom china censor internet,0
679,plan go continu gardenvarieti pussi come check tweet kind stfu,0
511,dead heat hyster woman ever,1
568,corey booker kamala harriss compet hyster woman senat,1
460,immigr danc art network dedic promot danc make perform immigr artist new york learn join network today,0
410,spent new sunglass next day find awesom pair,0
248,tri true method proven result,1
276,smell fear shoot dead street lot peopl will take,0
