,tweet,marker
451,mexican woman seek asylum way administr want legal way work,0
202,report suggest trump team seek end palestinian status refuge,0
377,senat pas bill enshrin billion militari aid packag israel law,0
548,fuck hoe ugli anyway trynna see pum pum like twanni say make nois skank as hoe say nigga chanc,1
783,mention book clair didnt stay kitchen either woman clear doesnt know shes talk howev yes much woman cook clean etc,1
429,local organis mike jone chair bexley meet earlier even anoth enjoy event interest speech discuss great compani thank attend,0
533,that youv alreadi titl raggidi skank whos disappoint father,1
313,rare move govt jail soldier kill lawyer say reform need,0
280,still clear put rescu migrant,0
426,new york new york,0
374,understand mind immigr undocu illeg break law therefor stay countri law respect,1
108,yearold swedish boy stab death syrian refuge classmat free speech time,0
788,shut hear skank total let david go way,1
411,celebr overcrowd refuge camp cox bazar far easi,0
432,meanwhil israel african refuge deport forceafrican refuge woman forc take contracept white jew welcom israel get isra citizenship black,1
270,illeg alien mother turn juvenil daughter rapist sneak u job scam caus,0
921,oh skank,1
24,franc adopt tough new law asylum immigr,1
149,greatitali take refuge send vatican squar live would make happi right,0
229,yes intent use languag describ sinc malta summit want turn illeg migrat legal migrat provid safe rout eu expand definit refuge includ migrant africa refuge,0
400,refuge u citizen al stori video âž_xd_,0
880,u rabid fuck cunt oh yea u indiana tho common u woman folk ask mother penc,1
723,everyon call u btch u dont like bitch like whaaat wouldnt call bitch u wore like whore wait someon dig dick stfu barbi yo nigga disagre,1
428,immigr famili reunit new york,0
758,real hyster woman,1
732,let see rape woman kick dog fat pig need neuter hung public squ,0
13,libyan coast guard rescu migrant,0
40,wonder support anoth well know model happen immigr fleshi pictur publish pastsh live whitehous far tell incred person would sh,0
595,anoth cunt name sandip appearedand cri develop okay cunt sandip justifi devic like x g famili come oreo moto z play get updat oreo motherfuck yo,0
245,peopl meet want refuge britain seem wonât contribut cost pay tax donât live among main young afford hord refuge cant peopl see,1
198,skill migrant resid polici great way new zealand gain migrant interest call new zealand perman new home today celebr success client unnikrishnan rajendran nair famili becom nz resid,0
792,like dude think woman want dick pussi bitch wouldnt touch foot pole shrimp dick toad fuck pesant go fuck matter fact hope lose dick never use fuck cunt,0
776,fuck puerto rico peopl know famili member bore wit live thru bare minimum stfu instead attack lie bullshit paper towel throw bullshit fuck liar piec,0
11,insan last weekend arizona invas,1
228,america fact real deal leader presid trump v liar loser crimin presid trump v jvfail oragn american leader v scandal immigr,0
932,whole bitch soft snitch untrustworthi teammat hoe,0
619,im friend crib east orang right window wide open hear pussi bitch suck dick that fuck cousin nigga,1
730,fuck call cracker bitch your go attack nice fuck cunt,1
912,fuck u raw tongu kiss drop hoe meet famili eat yo pussi backand tell love dont mean u itch,1
553,skank look like half man half actual nerv make fun someon el look cant make kind stupid ugli look like surgeri success congrat dude btw f,1
621,im perfect happi boyfriend bitch dont worri karma come skank as,1
245,peopl meet want refuge britain seem wonât contribut cost pay tax donât live among main young afford hord refuge cant peopl see,1
318,plenti diver elit start import rd world,1
445,russia say within come month near syrian refuge abl go home,0
468,what im inspir everi day hardwork team support around world emerg food assist,0
17,texa woman die fall move suv may push illeg alien driver,0
582,multipl woman hear share stori rape get fair trail,0
391,low black unemploy histori enforc law mean illeg longer take job low american wage destori black ommun likecompton ca,0
727,cum skank,1
101,quiet mani innoc peopl need die congress get butt pas legisl quit showboat judg know qualifi job protect american citizen,1
239,plea share oneman come web seri mr avail mr stori young chine immigr hollywood journey becom great actor time watch,0
65,muh immigrant,0
530,faker tool he compet see hyster woman senat surpris,1
321,appar consid set annual refuge admiss cap low number admit would blow smithereen budget nine feder resettl contractorslearn nine suppos chariti,1
994,your skank everyon know otherwis wouldnt make excus settl whilst hang multipl differ guy,1
812,ya allahthi filthi skank need cage match bring righteousnesswhat mean need put isi cage spray petroland light match thrown hanow that cure sin behavior w,0
257,salvini italia best men stop illig refuge gover europ stop return refuge home elect next time socialist like welcom loo wind chang,1
526,one two win prize hyster woman,1
452,nineteen dead migrant boat sink northern cyprus coast guard,0
584,left wh dead break abl buy million dollar home buy skank daughter million dollar apart boy would love see loan applic bank statement smell bank fraud tax shenanigan,1
788,shut hear skank total let david go way,1
477,actual wonder safe would feel stand middl group child refuge,1
3,invas issu mexican,1
253,canada pm justin trudeau spend billion illeg immigr cut aid veteran free speech time,1
420,inde unhcr report albania treat asylumseek welland mean exact via,0
906,lol your probabl tweet hard move dick pussi shut fuck fake hoe,1
316,save migrant sea one truck tyre,0
192,truth know christian refuge would problem havent see christian refuge shoot kill,0
893,im victim rape abus harrass never know woman havent experi,0
406,correct come town near,1
170,enter twilight zone cnn creat narrat night,0
906,lol your probabl tweet hard move dick pussi shut fuck fake hoe,1
3,invas issu mexican,1
778,hyster woman,1
165,delhi depict pathet scene aap come powerramp encroach appeas classilleg migrant jhugi sprung,1
157,saddiq khan hold refuge welcom sign like attend someon el hous parti invit bunch peopl dont know place saddiq,1
319,un migrat agenc reject trump nomine,0
318,plenti diver elit start import rd world,1
701,ok sure skank as troll bot go take bath toasterno one miss go,1
627,your skank cant afford wireless headphon stick rotten android phone buhby,1
819,youngboy sumn pussi boy,0
273,today â_x_ near burundian refuge two day open vocat train center insid mahama refuge camp,0
658,woman alleg rape make claim file suit,0
402,bandaid american want total immigr reform build wall get go congress right thing,1
500,shit ima choke yo as back say mine even tho im yo side nigga,1
813,yea dont think asshol think pussi go corrupt werent treason werent alreadi never john mccain friend never friend america yo,1
920,im sorri generat femal self respect internet shouldnt know your horni wet good pussi etc yall wonder boy treat yall like hoe pray generat,1
525,dont worri ann multiday meltdown simpli switch seat delta airplan flight last year still consid hyster woman,1
892,say keep safe wont wont keep woman safe rape cultur,0
527,stfu u hate as bitch go suck big dick pussi as hoe u lookin like rat,1
439,america interest trump interest,0
443,barcelona recent make public decis embrac migrant let tourist trade slide tourist wreck neighbourhood whilst migrant enrich cultur joke ðÿðÿðÿðÿðÿ,0
296,get immigr refuge board seem like stack,0
987,woman decid drop charg concern rape alleg doesnt mean didnt happen legal,0
550,lmao stfu nigga dont know shit im go nigga tryna ky dumb reason foh tri live life lmao pussi boy,0
667,ahh see final embrac inner blond skank good mitch,1
978,dollar sign hyster woman,1
492,ruth davidson interest lover immigr right anyth use poor scotland except suggest photo,1
406,correct come town near,1
629,like reward behavior train regular hyster,0
251,see full brutal ice impact immigr look insid u border,0
399,major never file asylum claim releas insid u big scam lot migrant pick kid leave get welfar free educ taxpa,1
671,ok like stfu hoe,1
672,nigga want ride dick choke die second dick juggl gargl ball like mouthwash control vagin wall like your squeez stress ball give type orgasm goodnight,1
394,angela merkel precari germani refuge row intensifi,0
374,understand mind immigr undocu illeg break law therefor stay countri law respect,1
558,enough thousand thousand angria get elect lose your like hilari clintonspoil petul entitledstfu,1
368,refuge dont get food water go back quick presid havnt much,1
858,booker win award put b hyster woman categori,1
376,russia build forc syria action isi welcom start talk migrant,1
631,fuck sacrificeyour fuck bitch as pussi need get ass beat piec shit,0
594,men your right gomez addam would never,1
30,look return refuge idp iraq elsewher human suffer negat develop trajectori go hand hand,0
135,theyv spread everi corner countri appar million know mani realli million infiltr u must go,1
412,everi cultur complain equal right includ one hide illeg immigr want give get life,0
625,shes kind skank dont want see light come close time along melania ivanka russian skank,1
861,think win hyster woman kamala runner drama queen go way gay w spartacus hysteria,0
135,theyv spread everi corner countri appar million know mani realli million infiltr u must go,1
144,migrant die mediterranean,0
416,special team peopl make respect rtd judg let visit indian state camp amp identifi illeg migrant amp peopl expir visa govt must ensur immedi deport,1
240,mani follow get everyday get last day grow daili,0
821,exact hyster woman sass hate,0
516,thank much creat hear packag see tweet differ take agre coulter booker harri compet hyster woman award realli appreci work put thx,1
923,talk bibl woman man properti therefor senseless misogynist rape marri woman happen,0
978,dollar sign hyster woman,1
358,would conserv parti recent make son pakistani muslim immigr home secretari whatabouterri high order new statesman,0
548,fuck hoe ugli anyway trynna see pum pum like twanni say make nois skank as hoe say nigga chanc,1
197,dont care immigr come racial background long get legal proper entri point know person tri get countri crimin background turn away dont need crimin,0
62,actual happen differ accord unhcr breakdown refuge woman child men age demograph peopl flee war,0
494,messag liber advoc open bordersif import third world get third world problem hard understand itth british nation parti continu campaign tradit britain,1
397,unhcr aid return somali refuge yemen via,0
646,bitch give fuck u fill ur glasssimon get instead that right whore im talk oh thank bill good realli fuck wasnt,1
415,illeg alien mexico accus rape yearold girl deprav illeg alien child rape cultur,1
402,bandaid american want total immigr reform build wall get go congress right thing,1
79,danish insist wear faceveil amp still desir live nonperson ghost muslim hopeless unabl assimil,1
74,mean guy separ immigr child parent border,0
362,note talk montreal startup ecosystem montreal good job bring immigr there key opportun bring montreal startup world globalfirst focus sourc,0
38,antitrump immigr demo cross brooklyn bridg new york,0
59,dont love citi buffalo code program seek open tech career door girl,0
790,hyster woman men look,1
646,bitch give fuck u fill ur glasssimon get instead that right whore im talk oh thank bill good realli fuck wasnt,1
564,your ugli fuck bitch take back word say wish slap stand infront blahe eye pussi bitch,1
485,boo hoo say ky refuge contractornot enough muslim place bowl green leftw medium conveni forget thing like thisiraqi refuge terrorist arrest bg good thing im remind,1
565,think bot argu your hyster cant understand basic mean word your still lose,0
326,illeg alien take life decid would break u steal id ssn work illeg rob u instead send famili kill realli didnt care famili huh,1
704,your man woman frank think sexual harass isnt big deal your perpetu rape cultur,0
578,oh gosh oh gosh head explod person tweet stay kitchen cook man clear person want show sole frnk misogynist life hed lead jami x clair that book show,0
909,ever hit w dumb fuck cunt as fuck stupid as fuck bitch know im extrem mad,1
846,choke leave hand slap head book step fuck face heel okay thank,0
576,could somebodi tell pay asshol keep interrupt confirm hear shut fuck,0
123,pay wall wast money caus stop illeg immigr come visa never go home,1
770,co u know woman rape survivor histor alway fair justic serv smh,0
488,thing think wrong shut govern get fund ask right numer time wherea gotten wrong everi time,1
926,respect u worri paint rapistharvey weinsteinon lose year woman report rape,0
758,real hyster woman,1
549,shut fuck stupud fuck edat go get fuck pussi irl dumb muslim,1
585,peopl say woman fault that wrong woman want unwant sexual advanc rape,0
61,prime minist theresa may keep remind u cultur enrich muslim immigr contribut britain via brit awaken,0
780,modern life becom increas issu support healthi night rest aid rest night,0
988,booker act like hyster woman there inuendo homosexu dog whistl cant complet imaginari,0
255,say uk need million new hous immigr need million less immigr,1
646,bitch give fuck u fill ur glasssimon get instead that right whore im talk oh thank bill good realli fuck wasnt,1
798,hyster woman touch anncouldnt agre candidaci alreadi,1
573,say want dick caus im sad sex make happi say im mental ill bitch stfu,0
413,lui mario rodriguestorr mexican illeg arrest connect rape yearold girl report contact via snapchat illeg pacif ocean gulf mexico law,0
945,multiyear champion hyster woman univers award im generous call woman,1
233,anoth reason easi jihadist islam countri slide across border illeg folk mexico central americaparanoid mayb littl dont want see countri look like european countri,1
957,think award go cori booker hyster woman,0
746,get job fat daddi fuck cunt that im pay rent dumb as hoe,1
257,salvini italia best men stop illig refuge gover europ stop return refuge home elect next time socialist like welcom loo wind chang,1
86,twelv refuge worker die italian road crash,0
754,ann coulter right bookerharri r behav like coupl hyster woman tri outdo,1
524,positivelyjoan rt altnatparks mike penc allow rape victim abort lead woman tri get rape rt ar,0
278,toronto nonwhit readili visibl crimethat much genocid b agenda lke complicityremigr easi come easi go,0
779,hyster mean logic wellread unapologet passion correct,0
712,refer woman call woman hoe bitch choos sexual activ wan na constant callin woman fuck hoe wrong bold,0
874,your date babi daddi call babi mama bitter go talk stfu mind busi bc know damn well nigga go lie get pussi play victim idc,1
250,announc vast major refuge flee kenya due tension moyal area march return genorouali open door sill provid protect remain one could,0
361,year ago legal immigr say insult anyon sneak countri would protect amp help amp want know amp other obey law cost crimin r worship amp hero rebuk evil,0
860,plea lot news open defec poverti miseri suppress woman religi intoler minor rape cultur get pictur want hear trust medium fake news ab,0
668,mf never listen feel feel quick blame bitch dont even know wtf wrong jus stfu dumb as hoe,1
277,migrant land itali five state take,0
925,pocket panini stovetop sandwich maker,0
274,hama leader say everi christian nation convert islam conquer migrat europ first america free speech time,0
26,europ want center africa vet migrant critic say abdic respons,0
608,sip wine yo bitch explain shit couldnt understand man yo woman perspect help grow stfu listen,0
897,ur lemon get woman drink sex u nikka that rape,0
725,im sit librari free period fuck bitch as hoe put backpack could sit wth,1
285,,0
536,kill war didnt rapemolest sell woman slave market didnt con,0
455,donald trump pull u un global compact migrat,0
130,illeg refuge includ syrian refuge mexican refuge south american refuge except venezuelan refuge go back home realli thing escap come legal dont see u burn mex flag,1
911,ever skank tri make fun tell suck dick shell magic turn hoe grab near dick within perimet,1
805,alreadi hold titl hyster racist whine beetch stfu,1
834,say ya fuck cunt puffinnow fuck go take your face shite,0
726,your whole entir bitch mother father probabl brother sister stupid fuck cunt,1
714,realli get tire everyon tell look like bitch like stop fuck prejudic fuck cunt,0
553,skank look like half man half actual nerv make fun someon el look cant make kind stupid ugli look like surgeri success congrat dude btw f,1
622,sometim feel like old mommi alway readi intim youeven lust mom pussi doesnt stop soak,1
159,problem toronto diver look ricardo duchesn canada decay white genocid crime polici optionto ignor role immigr invas hous disast isnt irrespons criminalhtt,1
533,that youv alreadi titl raggidi skank whos disappoint father,1
948,coulter need eat ham sandwich choke sexist comment plenti rw men truli hyster see presid act,0
774,yeah ask truth could character hyster woman someon idea woman actual,0
217,didnt liber say illeg kid illeg cant stay give custodi anoth illeg alien overid feder law,1
751,pussi repli tweet mute first pussi hahaha,1
44,msf offer health care evro refuge arriv rise,0
959,think booker hyster woman kamala,1
642,hyster woman way appli type feel specif gender absolut disgrac insinu woman hyster call woman insult,0
131,welfar refuge swiss reduc frank month,0
193,,0
24,franc adopt tough new law asylum immigr,1
407,must pass law deport border court illeg includ central american cross border illeg asylum contest remov order mandatori everifi,1
898,guy draw session last night neg woman next say dont get hyster believ right woman choos stfu also thx affirm well know fact misogynist draw like shit,0
152,help come peopl die govt countri crimin brand send immigr pack dem send u pack wors,1
513,polley write woman industri dont think anyon care tell rape cultur isnt acknowledg,0
749,bitch fuck whore fuck whore like get chanc act movi thousand struggl motherfuck bitch bitch doesnt know parent act clean,1
47,hungarian govern slam eu attitud toward mass migrat,0
742,let see brag grab woman pussi demean belittl peopl includ staff daili yeah see hear true stfu oh mueller come,0
717,patton oswalt hollywood comedian woman enjoy rape,0
255,say uk need million new hous immigr need million less immigr,1
462,side coin mani migrant get hous first place tragedi tragedi get new hous,1
705,oh doubt stay kitchen music slappin lil bit greeneri im cool lol busi damn that what yeah late there lot spot like poppin around way good would name visual name manifest,0
759,samantha dont shut fuck mind damn busi whole situat noth run fat mouth want sell pussi wou,1
199,tomorrow pm edt host facebook live event border texa address separ immigr famili tune gtgt,0
162,franc adopt controversi asylum immigr law via,0
87,trump win,1
753,rude fuck bitch cunt phone work want push cliff n jump rib ent phase,1
85,valedictorian daca illegali kindtook time busi brain surgeon scheduleto smuggl smore med student amp quantum physicist illeg ussh musta heard gon na use meritbas immigr system,1
243,shock declar belgium eu must close border turn back migrant boat european union ceas exist via oh myth moron final awaken,0
709,stfu pussi clear white guy fuck aggressor lay hand first typic respons kind,1
930,pssst father law crimin histori countri origin wouldv disqualifi citizenship your kick wh well send back whis chain migrat wife racist skank pretend,0
175,lot illeg muslim immigr r see delhi old delhiaround nzmamp yamuna banksokhladelhi fast becom slum,1
27,pari suburb aka muslim go zone home illeg immigr report say,0
508,peopl support youtub who mock rape like bitch wtf,0
977,rememb woman inferior men even though general test well everyth men doit fault suck there noth push away thing,1
843,hi way get ladi stop shout hear opposit desir effect love silent handmaid scream hyster woman insult caus mayb hold sign instead,1
97,taxpay burden expens legal process illeg refugeesyour opinion,1
798,hyster woman touch anncouldnt agre candidaci alreadi,1
687,wow fantast way cunt find denigr actual survivor rape sexual assault,0
289,boat act like taxi servic econom migrant pose refuge come europ seek welfar benefit west refuge stop turkey like real refuge instea,1
537,yea pussi boy like say ill get room,0
262,do noth stop steal american jobsw watch wont con billion wall fund tire useless talkit wont stop fli steal american jobsstop,1
36,immigr boy molest u custodi man hiv posit let sink look compass,0
401,foreign labor cheap mani employ simpli dont pay anyth let immigr sue court,0
368,refuge dont get food water go back quick presid havnt much,1
902,shut fuck know your bitch whore,1
457,arriv eu refuge make protest want money welcom,0
233,anoth reason easi jihadist islam countri slide across border illeg folk mexico central americaparanoid mayb littl dont want see countri look like european countri,1
75,mexican natur american follow immigr law pay fee wait sacrific lot pinch parasito come demand crap demand ice fk job deport parasit like pendejo asap,1
323,room go home immigr main part new hampshir full,1
321,appar consid set annual refuge admiss cap low number admit would blow smithereen budget nine feder resettl contractorslearn nine suppos chariti,1
205,rampant child rape expos detent center hiv posit worker catch rape kid,0
590,realli anyth case kindi would use low iq hyster woman zero talent,1
94,ontario concern listen immigr meet ottawa illeg cross,0
101,quiet mani innoc peopl need die congress get butt pas legisl quit showboat judg know qualifi job protect american citizen,1
309,coward last activ parti member involv illeg immigr industri,1
693,im go larp someon tv show otherwis might get engag recreat infanticid say well adjust hyster woman,0
77,cbi call favour treatment migrant,0
832,fuck face scari hoe dont say noth peopl look pussi post bitch fuck compet sit fuck shut fuck bitch wan na talk look where pic stay lane,1
135,theyv spread everi corner countri appar million know mani realli million infiltr u must go,1
517,great good moog buffalo bill look go littl kooki danc listen wild hors,0
289,boat act like taxi servic econom migrant pose refuge come europ seek welfar benefit west refuge stop turkey like real refuge instea,1
440,ice job stop obfusc immigr issu conflat term immigr illeg alien theyr illeg break u law need go back,1
441,first come transgend soldier amp say hell come immigr famili amp say hell number privat entiti decid stop busi amp didnt say anyth noth human right,0
123,pay wall wast money caus stop illeg immigr come visa never go home,1
133,white peopl stole land v everyon immigr africa via,0
580,hahahhahahahahahahahhahaha first wtf say sweeti like im atheist dont even want marri like stfu dear men stop rap u street make plea dumb motherfuck dont give shit bibl say man,0
331,never happen usa must deport muslim form nation becom american invad forc sharia u must go,1
137,addit possibl lose million holidaymak problem male violent african refuge spain could also lose fortun ex pat would move back uk other would buy properti spain spain take migrant,1
795,follow might know god know whoever charg kind lie monster dont think skank paula white side wont go flame,1
298,recu near migrant sea day,0
613,well hyster woman cadaver ghoulnow shut go back crypt sun,1
16,immigr legal servic depart accept new client plea call stop offic request intak appoint,0
509,repli tweet guy see time rape tweet sooo mani woman experienc,0
918,sweden four men rape woman cognit abil yearold walk freefour men charg gross rape development disabl woman yesterday set free court could prove knew development disabl,0
12,realiti nike unlik groupi never buy product enough enough ugli crap enough alreadi love flag,1
384,andrew cuomo self proclaim undocu immigr free crimin say jihad deport illeg that akin flip bird taxpay your embarrass amp disappoint law abi,1
501,yo pussi equival list celebr fuck u mean,1
863,yeah aw woman arent properti abus anymor terribl law child rape,0
387,pepsico ceo indra nooyi talk david rubenstein talk like woman immigr csuit bloomberg tv pepsico ceo indra nooyi talk david rubenstein,0
995,unfollow fuck pussi,0
499,,0
110,tire frighten exhaust victim jeer young woman help migrant victim,1
442,italian pm cont natofund aid libya new econom measur,0
662,corey booker demonstr world grandstand dramma mamma lie document avail content spartacus moment like hyster woman pm lol douch liar,0
100,mother w famili,1
875,alessia fkn skank go chang,1
516,thank much creat hear packag see tweet differ take agre coulter booker harri compet hyster woman award realli appreci work put thx,1
171,itali prime minist eu shun refuge amp migrant escap war hellish treatment libya local italian help shipwreck refuge flee syria amp iraq onto shore give food drink,0
816,okay hyster woman complet whacko traitor,0
744,bitch money talk stfu hoe go make bread,1
584,left wh dead break abl buy million dollar home buy skank daughter million dollar apart boy would love see loan applic bank statement smell bank fraud tax shenanigan,1
760,hyou bitch stfu ilym stupid dumb hoe,1
729,futur femaleaverag yr old man um woman stay kitchen ha clean hous hahahaham,1
716,ironi islam liter treat woman like sex slave hubsand allow rape wive everyday want,0
258,reason implement strict refuge vet procedur well reduc number refuge,0
34,juncker respons migrant step forward say cont,0
